{
  "id": "lu_01h8x0nadia0001",
  "subject_person_id": "person_marlow",
  "requester_person_id": "person_nadia",
  "medium": "video",
  "way": "photo",
  "adult_content": false,
  "source": "chat",
  "used_at": "2026-10-17T15:20:05.000Z",
  "created_at": "2026-10-17T15:20:05.000Z",
  "updated_at": "2026-10-17T15:20:05.000Z",
  "hlc": "1792250405000:0:hub001"
}
